店舗ID,店舗_名称,店舗_名称_カナ,店舗_概要,店舗_所在地,店舗_所在地_郵便番号,店舗_所在地_全国地方公共団体コード,店舗_所在地_都道府県名,店舗_所在地_郡名,店舗_所在地_市区町村名,店舗_所在地_行政区名,店舗_所在地_町域名以降,店舗_所在地_建物名,店舗_所在地_緯度,店舗_所在地_経度,店舗_業態_産業分類コード,店舗_業態_産業分類名,店舗_画像,店舗_タグ,店舗_営業時間,店舗_定休日,店舗_電話番号,店舗_FAX番号,店舗_メールアドレス,店舗_Webサイト,店舗_地図,店舗_Twitter,店舗_Facebookページ,店舗_インスタグラム,店舗_LINE,店舗_テイクアウト対応フラグ,店舗_デリバリー対応フラグ,店舗_閉店フラグ,店舗_登録日,店舗_最終更新日,店舗_補足
F0437,茶土家,チャット,,静岡県浜松市中区砂山町6-1メイワンエキマチイースト1F,4300926,221309,静岡県,,浜松市,中区,砂山町6-1,メイワンエキマチイースト1F,34.704168,137.734452,7651,酒場，ビヤホール,,,,,(053)452-3009,,,,,,,,,,,,2020-09-25,,
F0436,八丁蔵エキマチ店,ハッチョウグラエキマチテン,,静岡県浜松市中区砂山町6-1メイワンエキマチイースト1F,4300926,221309,静岡県,,浜松市,中区,砂山町6-1,メイワンエキマチイースト1F,34.704168,137.734452,7651,酒場，ビヤホール,,,,,(053)413-1232,,,,,,,,,,,,2020-09-25,,
F0435,COFFEE&BEER TRICO,コーヒーアンドビアトリコ,,静岡県浜松市中区砂山町6-1メイワンエキマチイースト1F,4300926,221309,静岡県,,浜松市,中区,砂山町6-1,メイワンエキマチイースト1F,34.704168,137.734452,7611,食堂，レストラン（専門料理店を除く）,,,,,(053)457-4877,,,,,,,,,,,,2020-09-25,,
F0434,杵屋浜松メイワンエキマチ店,キネヤハママツメイワンエキマチテン,,静岡県浜松市中区砂山町6-1メイワンエキマチイースト1F,4300926,221309,静岡県,,浜松市,中区,砂山町6-1,メイワンエキマチイースト1F,34.704168,137.734452,7631,そば・うどん店,,,,,(053)457-4875,,,,,,,,,,,,2020-09-25,,
F0433,タリーズコーヒーメイワンエキマチ店,タリーズコーヒーメイワンエキマチテン,,静岡県浜松市中区砂山町6-1メイワンエキマチイースト1F,4300926,221309,静岡県,,浜松市,中区,砂山町6-1,メイワンエキマチイースト1F,34.704168,137.734452,7671,喫茶店,,,,,(053)459-3210,,,,,,,,,,,,2020-09-25,,
F0425,居酒屋達の子,イザカヤタツノコ,,静岡県浜松市中区佐鳴台4-22-5大石店舗1号,4328021,221309,静岡県,,浜松市,中区,佐鳴台4-22-5,大石店舗1号,34.710356,137.701440,7651,酒場，ビヤホール,,,,,(053)523-8546,,,,,,,,,,,,2020-09-25,,
F0423,うなぎのかんたろう,ウナギノカンタロウ,,静岡県浜松市中区蜆塚2-2-2,4328018,221309,静岡県,,浜松市,中区,蜆塚2-2-2,,34.714033,137.708914,7621,日本料理店,,,,,(053)455-8823,,,https://kantarow.p-kit.com/,,,,,,,,,2020-09-25,,
F0414,イタリア料理ラフェスタ板屋町店,イタリアリョウリラフェスタイタヤマチテン,,静岡県浜松市中区板屋町104-1Dグラフォート浜松D'sタワー,4300928,221309,静岡県,,浜松市,中区,板屋町104-1,Dグラフォート浜松D'sタワー,34.706344,137.732857,7611,食堂，レストラン（専門料理店を除く）,,,,,(053)528-7216,,,https://lafesta2006.wixsite.com/lafesta-itaya,,,,,,,,,2020-09-30,,
F0410,しゃぶしゃぶ温野菜　浜松原島店,シャブシャブオンヤサイハママツバラジマテン,,静岡県浜松市東区原島町315-1,4350047,221309,静岡県,,浜松市,東区,原島町315-1,,34.731486,137.771389,7621,日本料理店,,,,,(053)411-5831,,,https://www.onyasai.com/,,,,,,,,,2020-09-25,,
F0270,民宿　食事処　松一,ミンシュクオショクジドコロマツイチ,,静岡県浜松市西区平松町2033,4311203,221309,静岡県,,浜松市,西区,平松町2033,,34.761273,137.634994,7611,食堂，レストラン（専門料理店を除く）,,,,,(053)487-1414,,,,,,,,,,,,2020-09-29,,
F0509,はなぜん,ハナゼン,,静岡県浜松市中区田町331-11Aビル1階,4300944,221309,静岡県,,浜松市,中区,田町331-11,Aビル1階,34.706338,137.732080,7611,食堂，レストラン（専門料理店を除く）,,,,,(053)457-0988,,,,,,,,,,,,2020-10-08,,
F0506,銀屋,ギンヤ,,静岡県浜松市中区田町323-5,4300944,221309,静岡県,,浜松市,中区,田町323-5,,34.707424,137.730320,7651,酒場，ビヤホール,,,,,(053)453-6278,,,,,,,,,,,,2020-10-07,,
F0505,心,ココロ,,静岡県浜松市中区旅籠町59,4328027,221309,静岡県,,浜松市,中区,旅籠町59,,34.702377,137.728600,7611,食堂，レストラン（専門料理店を除く）,,,,,(053)569-0889,,,,,,,,,,,,2020-10-08,,
F0503,天竜膳三好,テンリュウゼンミヨシ,,静岡県浜松市天竜区二俣町二俣932,4313314,221309,静岡県,,浜松市,天竜区,二俣町二俣932,,34.862708,137.810883,7622,料亭,,,,,(053)926-0344,,,https://www.t-miyoshi.com/,,,,,,,,,2020-10-08,,
F0501,だんす亭,ダンステイ,,静岡県浜松市中区田町231-4セリバテール日東,4300944,221309,静岡県,,浜松市,中区,田町231-4,セリバテール日東,34.709108,137.732242,7651,酒場，ビヤホール,,,,,(053)540-4579,,,,,,,,,,,,2020-10-06,,
F0500,浜膳,ハマゼン,,静岡県浜松市中区鴨江町21,4328024,221309,静岡県,,浜松市,中区,鴨江町21,,34.704775,137.723497,7621,日本料理店,,,,,(053)452-1048,,,,,,,,,,,,2020-10-07,,
F0496,Prele,プレール,,静岡県浜松市北区三ヶ日町大崎16-16(2階),4311403,221309,静岡県,,浜松市,北区,三ヶ日町大崎16-16,(2階),34.782879,137.572829,7611,食堂，レストラン（専門料理店を除く）,,,,,(053)526-0780,,,https://www.cafe-prele.com/,,,,,,,,,2020-10-07,,
F0495,弁松,ベンマツ,,静岡県浜松市中区尾張町124-27,4300949,221309,静岡県,,浜松市,中区,尾張町124-27,,34.710740,137.729107,7621,日本料理店,,,,,(053)452-6529,,,http://www.benmatsu.info/,,,,,,,,,2020-10-06,,
F0494,BON,ボン,,静岡県浜松市中区肴町314-24,4300932,221309,静岡県,,浜松市,中区,肴町314-24,,34.707069,137.728569,7651,酒場，ビヤホール,,,,,(053)454-5503,,,,,,,,,,,,2020-10-06,,
F0493,揚州厨房,ヨウシュウチュウボウ,,静岡県浜松市中区板屋町111-2浜松アクトタワーB1F,4307790,221309,静岡県,,浜松市,中区,板屋町111-2,浜松アクトタワーB1F,34.705231,137.735788,7623,中華料理店,,,,,(053)453-1688,,,https://yoshu.owst.jp/,,,,,,,,,2020-10-06,,
F0492,濱作,ハマサク,,静岡県浜松市中区田町331-8,4300944,221309,静岡県,,浜松市,中区,田町331-8,,34.706514,137.732114,7621,日本料理店,,,,,(053)454-4851,,,,,,,,,,,,2020-10-07,,
F0491,中川屋,ナカガワヤ,,静岡県浜松市東区中野町861-2,4350004,221309,静岡県,,浜松市,東区,中野町861-2,,34.729127,137.798581,7629,その他の専門料理店,,,,,(053)421-0007,,,http://nakagawaya.jp/,,,,,,,,,2020-10-06,,
F0490,ITAYAMACHI BaR,イタヤマチバル,,静岡県浜松市中区板屋町612,4300928,221309,静岡県,,浜松市,中区,板屋町612,,34.707506,137.735461,7699,他に分類されない飲食店,,,,,(053)525-7435,,,http://www.tromba.jp/,,,,,,,,,2020-10-05,,
F0487,居食処美園,イショクドコロミソノ,,静岡県浜松市東区天龍川町162-1,4350013,221309,静岡県,,浜松市,東区,天龍川町162-1,,34.720502,137.778813,7621,日本料理店,,,,,(053)421-3917,,,,,,,,,,,,2020-10-05,,
F0486,酒處ひら山,サケドコロヒラヤマ,,静岡県浜松市中区肴町318-26MUSE肴町1F,4300932,221309,静岡県,,浜松市,中区,肴町318-26,MUSE肴町1F,34.706194,137.729187,7651,酒場，ビヤホール,,,,,(053)454-2567,,,,,,,,,,,,2020-10-07,,
F0485,福三三,フクミミ,,静岡県浜松市中区砂山町360-7,4300926,221309,静岡県,,浜松市,中区,砂山町360-7,,34.701463,137.734354,7651,酒場，ビヤホール,,,,,(053)450-6888,,,,,,,,,,,,2020-10-02,,
F0484,居酒屋ほりかわ,イザカヤホリカワ,,静岡県浜松市中区田町330-1マビーセブンビル2F,4300944,221309,静岡県,,浜松市,中区,田町330-1,マビーセブンビル2F,34.706897,137.731509,7651,酒場，ビヤホール,,,,,(053)453-5870,,,https://r.gnavi.co.jp/gm7chfa90000/,,,,,,,,,2020-10-05,,
F0483,鳥焼もろ川,トリヤキモロカワ,,静岡県浜松市中区尾張町116-26,4300949,221309,静岡県,,浜松市,中区,尾張町116-26,,34.710830,137.728831,7629,その他の専門料理店,,,,,(053)458-8800,,,http://www.morokawa.com/,,,,,,,,,2020-10-07,,
F0479,清水家,シミズヤ,,静岡県浜松市北区細江町気賀238-2,4311305,221309,静岡県,,浜松市,北区,細江町気賀238-2,,34.807805,137.655184,7629,その他の専門料理店,,,,,(053)522-0063,,,https://www.unagi-shimizuya.jp/,,,,,,,,,2020-10-05,,
F0477,焼肉　虎,ヤキニクトラ,,静岡県浜松市中区高丘東1-1-32,4338117,221309,静岡県,,浜松市,中区,高丘東1-1-32,,34.753646,137.712114,7611,食堂，レストラン（専門料理店を除く）,,,,,(053)522-8129,,,https://activitysurvival.wixsite.com/tora,,,,,,,,,2020-10-02,,
F0476,炭火焼肉火の国中田店,スミビヤキニクヒノクニナカタテン,,静岡県浜松市東区中田町85,4350057,221309,静岡県,,浜松市,東区,中田町85,,34.732423,137.755363,7625,焼き肉店,,,,,(053)460-1129,,,,,,,,,,,,2020-10-07,,
F0475,火の蔵　上西店,ヒノクラカミニシテン,,静岡県浜松市東区上西町1154-1,4350048,221309,静岡県,,浜松市,東区,上西町1154-1,,34.723055,137.760216,7625,焼き肉店,,,,,(053)461-4708,,,,,,,,,,,,2020-10-02,,
F0474,大戸屋ごはん処イオンモール浜松志都呂店,オオトヤゴハンドコロイオンモールハママツシトロテン,,静岡県浜松市西区志都呂2-37-1イオンモール浜松志都呂2階,4328069,221309,静岡県,,浜松市,西区,志都呂2-37-1,イオンモール浜松志都呂2階,34.697180,137.649390,7611,食堂，レストラン（専門料理店を除く）,,,,,(053)415-0300,,,,,,,,,,,,2020-10-02,,
F0473,博多屋台や浜松店,ハカタヤタイヤハママツテン,,静岡県浜松市中区船越町50-1,4300913,221309,静岡県,,浜松市,中区,船越町50-1,,34.717905,137.748132,7611,食堂，レストラン（専門料理店を除く）,,,,,(053)461-5777,,,https://hakatayataiyahamamatsu.owst.jp/,,,,,,,,,2020-10-02,,
F0404,サイゼリヤ サンストリート浜北店,サイゼリヤサンストリートハマキタテン,,静岡県浜松市浜北区平口2861サンストリート浜北2F,4340041,221309,静岡県,,浜松市,浜北区,平口2861,サンストリート浜北2F,34.794831,137.760828,7611,食堂，レストラン（専門料理店を除く）,,,,,(053)585-7111,,,https://www.saizeriya.co.jp/,,,,,,,,,2020-10-05,,
F0403,サンストリート浜北フードコートエリア（上海媽媽/マクドナルド/はなまるうどん/クマールさんのカレー/中華そば楽描）,サンストリートハマキタフードコートエリアシャンハイマママクドナルドハナマルウドンクマールサンノカレースガキヤ,,静岡県浜松市浜北区平口2861サンストリート浜北,4340041,221309,静岡県,,浜松市,浜北区,平口2861,サンストリート浜北,34.794831,137.760828,7699,他に分類されない飲食店,,,,,(053)585-7111,,,http://www.sunstreet-hamakita.com/,,,,,,,,,2020-10-05,,
F0524,焼き鳥とワイン　志ノ蔵,ヤキトリトワインシノクラ,,静岡県浜松市中区千歳町76-4,4300934,221309,静岡県,,浜松市,中区,千歳町76-4,,34.703605,137.730639,7629,その他の専門料理店,,,,,(053)454-4096,,,http://www.hot-farm.net/shinokura/,,,,,,,,,2020-10-15,,
F0523,おばんざい季遊,オバンザイキユウ,,静岡県浜松市中区連尺町309-16寺澤ビル1階,4300939,221309,静岡県,,浜松市,中区,連尺町309-16,寺澤ビル1階,34.706544,137.727665,7611,食堂，レストラン（専門料理店を除く）,,,,,(053)458-2788,,,,,,,,,,,,2020-10-15,,
F0522,銀座たこ専　浜松本店,ギンザタコセンハママツホンテン,,静岡県浜松市東区小池町158-1,4350056,221309,静岡県,,浜松市,東区,小池町158-1,,34.754692,137.763387,7692,お好み焼き・焼きそば・たこ焼き店,,,,,(053)432-1208,,,https://www.bon-chic.jp,,,,,,,,,2020-10-15,,
F0521,イタリア食堂　オルトラーナ,イタリアショクドウオルトラーナ,,静岡県浜松市南区東町95-5,4300822,221309,静岡県,,浜松市,南区,東町95-5,,34.681006,137.783213,7629,その他の専門料理店,,,,,(053)427-3077,,,http://ortolana.net,,,,,,,,,2020-10-13,,
F0520,一蘭浜松店,イチランハママツテン,,静岡県浜松市東区篠ケ瀬町1056-1,4350042,221309,静岡県,,浜松市,東区,篠ケ瀬町1056-1,,34.723847,137.774565,7624,ラーメン店,,,,,(053)461-3773,,,https://ichiran.com/index.php,,,,,,,,,2020-10-15,,
F0518,イタリア風料理　IL CIELO,イタリアフウリョウリイルチェーロ,,静岡県浜松市中区上島2-10-1米澤ビル1F南,4308122,221309,静岡県,,浜松市,中区,上島2-10-1,米澤ビル1F南,34.741967,137.739395,7611,食堂，レストラン（専門料理店を除く）,,,,,(070)2829-4544,,,https://ilcielo-hamamatsu.jimdofree.com/,,,,,,,,,2020-10-13,,
F0517,さかい珈琲　浜松小沢渡店,サカイコーヒーハママツコザワタリテン,,静岡県浜松市南区小沢渡町1395,4328063,221309,静岡県,,浜松市,南区,小沢渡町1395,,34.683845,137.676239,7671,喫茶店,,,,,(053)415-9561,,,,,,,,,,,,2020-10-15,,
F0516,いし川,イシカワ,,静岡県浜松市中区板屋町672FOOD昴ビル2F,4300928,221309,静岡県,,浜松市,中区,板屋町672,FOOD昴ビル2F,34.706980,137.735746,7621,日本料理店,,,,,(053)452-1466,,,,,,,,,,,,2020-10-14,,
F0514,TEMAJI,テマージ,,静岡県浜松市西区志都呂2-1-27,4328069,221309,静岡県,,浜松市,西区,志都呂2-1-27,,34.698677,137.655206,7611,食堂，レストラン（専門料理店を除く）,,,,,(053)488-7761,,,,,,,,,,,,2020-10-12,,
F0513,ブラウニーサンドイッチ,ブラウニーサンドイッチ,,静岡県浜松市東区安新町550-4,4350005,221309,静岡県,,浜松市,東区,安新町550-4,,34.729306,137.791180,7691,ハンバーガー店,,,,,(053)571-8034,,,http://brownie-sandwich.com,,,,,,,,,2020-10-15,,
F0512,炭火焼鳥だいち,スミビヤキトリダイチ,,静岡県浜松市中区元城町218-9エルム元城1F,4300946,221309,静岡県,,浜松市,中区,元城町218-9,エルム元城1F,34.708814,137.728176,7629,その他の専門料理店,,,,,(053)452-7772,,,,,,,,,,,,2020-10-12,,
F0511,喫茶＆スナックあすなろ,キッサアンドスナックアスナロ,,静岡県浜松市東区薬師町361,4350017,221309,静岡県,,浜松市,東区,薬師町361,,34.721601,137.782791,7651,酒場，ビヤホール,,,,,(053)421-7272,,,,,,,,,,,,2020-10-13,,
F0510,野鳩,ノバト,,静岡県浜松市中区海老塚1-15-4,4328033,221309,静岡県,,浜松市,中区,海老塚1-15-4,,34.699113,137.729040,7611,食堂，レストラン（専門料理店を除く）,,,,,(053)482-8889,,,,,,,,,,,,2020-10-09,,
F0508,bistro atable,ビストロアターブル,,静岡県浜松市中区富塚町2299-3,4328002,221309,静岡県,,浜松市,中区,富塚町2299-3,,34.719483,137.700538,7629,その他の専門料理店,,,,,(053)528-7567,,,https://www.bistro-atable.com/,,,,,,,,,2020-10-12,,
F0507,麺処　びぎ屋　浜松店,メンドコロビギヤハママツテン,,静岡県浜松市中区鴨江3-29-20,4328023,221309,静岡県,,浜松市,中区,鴨江3-29-20,,34.708944,137.714187,7624,ラーメン店,,,,,(053)456-6868,,,,,,,,,,,,2020-10-12,,
F0504,新中国料理ムーラン,シンチュウゴクリョウリムーラン,,静岡県浜松市西区雄踏町宇布見4863-178,4310102,221309,静岡県,,浜松市,西区,雄踏町宇布見4863-178,,34.695933,137.636079,7623,中華料理店,,,,,(053)596-3939,,,http://www.wr-salt.com/mulan/,,,,,,,,,2020-10-12,,
F0502,田吾松,タゴマツ,,静岡県浜松市西区西山町2298-3,4328001,221309,静岡県,,浜松市,西区,西山町2298-3,,34.741404,137.678369,7692,お好み焼き・焼きそば・たこ焼き店,,,,,(053)485-5918,,,,,,,,,,,,2020-10-13,,
F0499,ビラックス高薗,ビラックスタカソノ,,静岡県浜松市浜北区高薗381,4340023,221309,静岡県,,浜松市,浜北区,高薗381,,34.789380,137.817440,7611,食堂，レストラン（専門料理店を除く）,,,,,(053)586-8886,,,,,,,,,,,,2020-10-14,,
F0498,焼鰻　中ノ庄,ヤキウナギナカノショウ,,静岡県浜松市中区鍛冶町1-2かじ町プラザ1階,4300933,221309,静岡県,,浜松市,中区,鍛冶町1-2,かじ町プラザ1階,34.702742,137.731494,7629,その他の専門料理店,,,,,(053)458-1278,,,http://nakanosho.com/sp/,,,,,,,,,2020-10-09,,
F0497,HANCHAR'S,ハンチャーズ,,静岡県浜松市中区鍛冶町318-15とんか亭ビルB1F,4300933,221309,静岡県,,浜松市,中区,鍛冶町318-15,とんか亭ビルB1F,34.706302,137.729976,7629,その他の専門料理店,,,,,(053)456-8805,,,https://hanchars.owst.jp/,,,,,,,,,2020-10-09,,
F0283,果汁工房果琳 イオンモール浜松志都呂店,カジュウコウボウカリンイオンモールハママツシトロテン,,静岡県浜松市西区志都呂2-37-1イオンモール浜松志都呂1階,4328069,221309,静岡県,,浜松市,西区,志都呂2-37-1,イオンモール浜松志都呂1階,34.697180,137.649390,7671,喫茶店,,,,,(053)401-1707,,,,,,,,,,,,2020-10-09,,
F0529,Remplir ランプリール,ランプリール,,静岡県浜松市西区入野町740-1,4328061,221309,静岡県,,浜松市,西区,入野町740-1,,34.699429,137.698490,7611,食堂，レストラン（専門料理店を除く）,,,,,(053)415-0727,,,https://rempliririno.wixsite.com/remplir,,,,,,,,,2020-10-22,,
F0528,ティルナノーグ,ティルナノーグ,,静岡県浜松市中区田町329-8マルマンビルB1,4300944,221309,静岡県,,浜松市,中区,田町329-8,マルマンビルB1,34.707130,137.732173,7651,酒場，ビヤホール,,,,,(053)450-6006,,,,,,,,,,,,2020-10-22,,
F0527,氷箱里,ビンシャンリィ,,静岡県浜松市中区板屋町628Y3ビル5階,4300928,221309,静岡県,,浜松市,中区,板屋町628,Y3ビル5階,34.707301,137.734789,7623,中華料理店,,,,,(053)451-3031,,,http://www.bing-xiang-li.com/,,,,,,,,,2020-10-21,,
F0515,cafe gaku,カフェガク,,静岡県浜松市北区細江町気賀342-3,4311305,221309,静岡県,,浜松市,北区,細江町気賀342-3,,34.806538,137.652161,7671,喫茶店,,,,,(053)522-0012,,,,,,,,,,,,2020-10-19,,
F0541,炭火焼き鳥diningらん,スミビヤキトリダイニングラン,,静岡県浜松市中区肴町313-11田島ビル,4300932,221309,静岡県,,浜松市,中区,肴町313-11,田島ビル,34.706578,137.728710,7611,食堂，レストラン（専門料理店を除く）,,,,,(053)452-2211,,,,,,,,,,,,2020-10-29,,
F0538,CLOUD9,クラウドナイン,,静岡県浜松市中区板屋町102-16Keiビル2F,4300928,221309,静岡県,,浜松市,中区,板屋町102-16,Keiビル2F,34.707219,137.733167,7611,食堂，レストラン（専門料理店を除く）,,,,,(053)456-4444,,,https://cloud9.jpn.com/,,,,,,,,,2020-10-28,,
F0537,willcoffee&bar,ウィルコーヒーアンドバー,,静岡県浜松市中区田町329-17オオクボビル1.2階,4300944,221309,静岡県,,浜松市,中区,田町329-17,オオクボビル1.2階,34.707059,137.731387,7611,食堂，レストラン（専門料理店を除く）,,,,,(053)456-0717,,,,,,,,,,,,2020-10-26,,
F0536,鮨ぜん,スシゼン,,静岡県浜松市北区細江町中川5903-6,4311304,221309,静岡県,,浜松市,北区,細江町中川5903-6,,34.800588,137.664493,7641,すし店,,,,,(053)482-9132,,,,,,,,,,,,2020-10-26,,
F0535,温（HARU）,ハル,,静岡県浜松市中区肴町19-42,4300932,221309,静岡県,,浜松市,中区,肴町19-42,,34.706609,137.729550,7651,酒場，ビヤホール,,,,,(053)457-5757,,,,,,,,,,,,2020-10-23,,
F0534,フレッシュネスバーガー浜松アクトシティ店,フレッシュネスバーガーハママツアクトシティテン,,静岡県浜松市中区板屋町111-2アクトタワー2階,4307702,221309,静岡県,,浜松市,中区,板屋町111-2,アクトタワー 2階,34.705231,137.735788,7691,ハンバーガー店,,,,,(053)451-3441,,,,,,,,,,,,2020-10-27,,
F0532,有限会社 神谷ふぐ料理店,カミヤフグリョウリテン,,静岡県浜松市中区田町329-8,4300944,221309,静岡県,,浜松市,中区,田町329-8,,34.707130,137.732173,7621,日本料理店,,,,,(053)453-6606,,,https://fugu-kamiya.hama-matsu.com/,,,,,,,,,2020-10-23,,
F0530,寧々家浜松モール街店,ネネヤハママツモールガイテン,,静岡県浜松市中区鍛冶町503-4松菱通りB-2ビル1F,4300933,221309,静岡県,,浜松市,中区,鍛冶町503-4,松菱通りB-2ビル1F,34.705028,137.731014,7651,酒場，ビヤホール,,,,,(053)452-2131,,,https://www.atom-corp.co.jp,,,,,,,,,2020-10-26,,
F0519,Tournez La Page,トゥルネラパージュ,,静岡県浜松市中区板屋町628Y3ビル1階,4300928,221309,静岡県,,浜松市,中区,板屋町628,Y3ビル1階,34.707301,137.734789,7671,喫茶店,,,,,(053)455-7100,,,http://tournezlapage.jp/,,,,,,,,,2020-10-23,,
F0543,トラットリアオット,トラットリアオット,,静岡県浜松市中区板屋町628Y3ビル4階,4300928,221309,静岡県,,浜松市,中区,板屋町628,Y3ビル4階,34.707301,137.734789,7611,食堂，レストラン（専門料理店を除く）,,,,,(053)458-8288,,,,,,,,,,,,2020-11-04,,
F0550,森のチーズケーキやさん,モリノチーズケーキヤサン,,静岡県浜松市西区和地町2949,4311115,221309,静岡県,,浜松市,西区,和地町2949,,34.765327,137.657330,7699,他に分類されない飲食店,,,,,(053)486-1723,,,https://www.nukumori.jp/,,,,,,,,,2020-11-11,,
F0544,居酒屋　貴布祢　あづまや,イザカヤキブネアヅマヤ,,静岡県浜松市浜北区貴布祢3000番地なゆた浜北ビル205,4340038,221309,静岡県,,浜松市,浜北区,貴布祢3000番地,なゆた浜北ビル205,34.791625,137.783253,7611,食堂，レストラン（専門料理店を除く）,,,,,(053)587-2510,,,,,,,,,,,,2020-11-06,,
F0561,シリウス,シリウス,,静岡県浜松市中区利町305-16,4300937,221309,静岡県,,浜松市,中区,利町305-16,,34.706029,137.726584,7671,喫茶店,,,,,(053)455-4009,,,,,,,,,,,,2020-11-26,,
F0557,タリーズコーヒーイオンモール浜松志都呂店,タリーズコーヒーイオンモールハママツシトロテン,,静岡県浜松市西区志都呂2-37-1,4328069,221309,静岡県,,浜松市,西区,志都呂2-37-1,,34.697180,137.649390,7671,喫茶店,,,,,(053)415-2070,,,,,,,,,,,,2020-11-26,,
F0556,B.B.B.,ビービービー,,静岡県浜松市中区下池川町30-5,4300905,221309,静岡県,,浜松市,中区,下池川町30-5,,34.717338,137.726884,7611,食堂，レストラン（専門料理店を除く）,,,,,(080)5104-1701,,,,,,,,,,,,2020-11-25,,
F0554,アソビストロシェルター,アソビストロシェルター,,静岡県浜松市中区新津町40-1サンポートビル1F,4300911,221309,静岡県,,浜松市,中区,新津町40-1,サンポートビル1F,34.723427,137.738646,7651,酒場，ビヤホール,,,,,(053)424-8655,,,,,,,,,,,,2020-11-26,,
F0553,居酒屋シーナ,イザカヤシーナ,,静岡県浜松市中区千歳町22杉本ビル1階西,4300934,221309,静岡県,,浜松市,中区,千歳町22,杉本ビル1階西,34.703923,137.729683,7651,酒場，ビヤホール,,,,,,,,,,,,,,,,,2020-11-20,,
F0552,Petit ami cafe,プティアミカフェ,,静岡県浜松市中区鍛冶町1-60アルペンマンション1F,4300933,221309,静岡県,,浜松市,中区,鍛冶町1-60,アルペンマンション1F,34.702885,137.731988,7629,その他の専門料理店,,,,,(053)452-3330,,,https://petitamicafe.com/,,,,,,,,,2020-11-24,,
F0551,美好寿司,ミヨシズシ,,静岡県浜松市中区元浜町78-3,4300942,221309,静岡県,,浜松市,中区,元浜町78-3,,34.714108,137.731770,7641,すし店,,,,,(053)471-2384,,,,,,,,,,,,2020-11-24,,
F0549,お家カフェきっさこ,オウチカフェキッサコ,,静岡県浜松市中区和地山2-21-16,4328003,221309,静岡県,,浜松市,中区,和地山2-21-16,,34.728771,137.718153,7611,食堂，レストラン（専門料理店を除く）,,,,,(070)5035-0059,,,,,,,,,,,,2020-11-20,,
F0548,ひょうたん　浜松店,ヒョウタンハママツテン,,静岡県浜松市東区上新屋町17-1,4350053,221309,静岡県,,浜松市,東区,上新屋町17-1,,34.731325,137.765182,7611,食堂，レストラン（専門料理店を除く）,,,,,(053)589-5223,,,,,,,,,,,,2020-11-24,,
F0547,はままつフルーツパーク時の栖　フルーツ工房（ピザ工房）,ハママツフルーツパークトキノスミカ　フルーツコウボウ,,静岡県浜松市北区都田4263-1,4312102,221309,静岡県,,浜松市,北区,都田4263-1,,34.839847,137.732386,7629,その他の専門料理店,,,,,(053)428-5211,,,http://www.tokinosumika.com/hamamatsufp/,,,,,,,,,2020-11-24,,
F0546,はままつフルーツパーク時の栖　ワイナリービアレストランペルレ,ハママツフルーツパークトキノスミカ　ワイナリービアレストランペルレ,,静岡県浜松市北区都田4263-1,4312102,221309,静岡県,,浜松市,北区,都田4263-1,,34.839847,137.732386,7611,食堂，レストラン（専門料理店を除く）,,,,,(053)428-5211,,,http://www.tokinosumika.com/hamamatsufp/,,,,,,,,,2020-11-24,,
