店舗ID,店舗_名称,店舗_名称_カナ,店舗_概要,店舗_所在地,店舗_所在地_郵便番号,店舗_所在地_全国地方公共団体コード,店舗_所在地_都道府県名,店舗_所在地_郡名,店舗_所在地_市区町村名,店舗_所在地_行政区名,店舗_所在地_町域名以降,店舗_所在地_建物名,店舗_所在地_緯度,店舗_所在地_経度,店舗_業態_産業分類コード,店舗_業態_産業分類名,店舗_画像,店舗_タグ,店舗_営業時間,店舗_定休日,店舗_電話番号,店舗_FAX番号,店舗_メールアドレス,店舗_Webサイト,店舗_地図,店舗_Twitter,店舗_Facebookページ,店舗_インスタグラム,店舗_LINE,店舗_テイクアウト対応フラグ,店舗_デリバリー対応フラグ,店舗_閉店フラグ,店舗_登録日,店舗_最終更新日,店舗_補足
F0731,やきとり家すみれ浜松篠ヶ瀬店,ヤキトリヤスミレハママツササガセテン,,静岡県浜松市東区篠ケ瀬町241,4350042,221309,静岡県,,浜松市,東区,篠ケ瀬町241,,34.729879,137.772947,7629,その他の専門料理店,,,,,(053)467-4129,,,https://stc-smile.jp/,,,,,,,,,2021-03-04,,
F0729,HUNGRY's 浜松店,ハングリーズハママツテン,,静岡県浜松市南区参野町154-1,4300816,221309,静岡県,,浜松市,南区,参野町154-1,,34.694456,137.755824,7611,食堂，レストラン（専門料理店を除く）,,,,,(053)401-8024,,,http://hungrys-jp.com/index.html,,,,,,,,,2021-02-26,,
F0727,水辺のおやど　いのうえ,ミスベノオヤドイノウエ,,静岡県浜松市西区舞阪町弁天島3742,4310214,221309,静岡県,,浜松市,西区,舞阪町弁天島3742,,34.694287,137.602984,7621,日本料理店,,,,,(053)596-1166,,,http://www.hamanako-inoue.jp/,,,,,,,,,2021-02-26,,
F0726,SAKANAMACHI　SALONE,サカナマチサローネ,,静岡県浜松市中区肴町316-44山口屋ビル3階東,4300932,221309,静岡県,,浜松市,中区,肴町316-44,山口屋ビル3階東,34.706947,137.728894,7661,バー，キャバレー，ナイトクラブ,,,,,,,,,,,,,,,,,2021-03-02,,
F0724,うなぎ白焼山口,ウナギシラヤキヤマグチ,,静岡県浜松市北区細江町気賀172-2,4311305,221309,静岡県,,浜松市,北区,細江町気賀172-2,,34.805821,137.655638,7629,その他の専門料理店,,,,,(053)523-1211,,,,,,,,,,,,2021-02-26,,
F0723,旬鮮　永谷,シュンセンナガタニ,,静岡県浜松市中区元浜町133,4300942,221309,静岡県,,浜松市,中区,元浜町133,,34.714826,137.733001,7611,食堂，レストラン（専門料理店を除く）,,,,,(053)472-3827,,,,,,,,,,,,2021-03-02,,
F0721,TRATTORIA　GUIDO,トラットリアグイド,,静岡県浜松市東区天王町1790-5,4350052,221309,静岡県,,浜松市,東区,天王町1790-5,,34.735987,137.768530,7611,食堂，レストラン（専門料理店を除く）,,,,,(053)523-9436,,,,,,,,,,,,2021-02-26,,
F0719,暖笑,ダンショウ,,静岡県浜松市東区小池町1578-1,4350056,221309,静岡県,,浜松市,東区,小池町1578-1,,34.747678,137.752536,7611,食堂，レストラン（専門料理店を除く）,,,,,(053)462-6111,,,,,,,,,,,,2021-02-26,,
F0717,たばこや,タバコヤ,,静岡県浜松市中区相生町3-3,4300805,221309,静岡県,,浜松市,中区,相生町3-3,,34.708690,137.745254,7651,酒場，ビヤホール,,,,,(053)466-5755,,,,,,,,,,,,2021-03-02,,
F0714,酒楽食堂けんしん,シュラクショクドウケンシン,,静岡県浜松市中区連尺町313-31連尺クローバービル101,4300939,221309,静岡県,,浜松市,中区,連尺町313-31,連尺クローバービル101,34.706639,137.728364,7651,酒場，ビヤホール,,,,,(053)548-4138,,,https://kenshin.owst.jp/,,,,,,,,,2021-03-02,,
F0712,炭火焼肉　上杉　浜松根上がり松店,スミビヤキニクウエスギハママツネアガリマツテン,,静岡県浜松市中区鴨江2-55-29,4328023,221309,静岡県,,浜松市,中区,鴨江2-55-29,,34.705091,137.708029,7625,焼き肉店,,,,,(053)458-2133,,,https://nts-group.jp/,,,,,,,,,2021-03-02,,
F0711,しまうま珈琲浜北店,シマウマコーヒーハマキタテン,,静岡県浜松市浜北区平口167-1,4340041,221309,静岡県,,浜松市,浜北区,平口167-1,,34.800052,137.762960,7671,喫茶店,,,,,(053)587-4696,,,http://shimaumacoffee.com/,,,,,,,,,2021-02-26,,
F0700,DiningBar NAGIRA,ダイニングバーナギラ,,静岡県浜松市中区板屋町651,4300928,221309,静岡県,,浜松市,中区,板屋町651,,34.706548,137.734835,7699,他に分類されない飲食店,,,,,(053)451-5077,,,http://www.diningbarnagira.com/,,,,,,,,,2021-03-02,,
F0699,一品料理　むら松,イッピンリョウリ,,静岡県浜松市東区小池町163-2,4350056,221309,静岡県,,浜松市,東区,小池町163-2,,34.754729,137.763689,7621,日本料理店,,,,,(053)434-3609,,,,,,,,,,,,2021-03-01,,
F0696,くいもの屋わん 浜松駅前店,クイモノヤワンハママツエキマエテン,,静岡県浜松市中区千歳町95-9花柳ビル 2F,4300934,221309,静岡県,,浜松市,中区,千歳町95-9,花柳ビル 2F,34.704060,137.731337,7651,酒場，ビヤホール,,,,,(053)450-2800,,,https://www.oizumifoods.co.jp/search/758,,,,,,,,,2021-02-26,,
F0695,Cafe&Restaurant LENRI,カフェアンドレストランレンリ,,静岡県浜松市北区都田町8501-2,4312102,221309,静岡県,,浜松市,北区,都田町8501-2,,34.813418,137.732912,7629,その他の専門料理店,,,,,(053)428-7000,,,https://lenri.com/,,,,,,,,,2021-03-02,,
F0692,沼津魚がし鮨　流れ鮨　浜松市野店,ヌマヅウオガシズシナガレズシハママツイチノテン,,静岡県浜松市東区天王町1981-1,4350052,221309,静岡県,,浜松市,東区,天王町1981-1,,34.737051,137.762677,7641,すし店,,,,,(053)468-5519,,,https://www.uogashizushi.co.jp/shop/w-shop/nagare-hamamatsuichino/,,,,,,,,,2021-02-26,,
F0689,うなぎ　千草,ウナギ　チグサ,,静岡県浜松市北区三ヶ日町三ヶ日1148-10,4311414,221309,静岡県,,浜松市,北区,三ヶ日町三ヶ日1148-10,,34.803352,137.552310,7629,その他の専門料理店,,,,,(053)524-0809,,,,,,,,,,,,2021-03-04,,
F0675,nomidokoro CUCCIOLO,ノミドコロクッチョロ,,静岡県浜松市中区富塚町4710-2,4328002,221309,静岡県,,浜松市,中区,富塚町4710-2,,34.714968,137.704391,7651,酒場，ビヤホール,,,,,(053)570-3513,,,,,,,,,,,,2021-02-26,,
F0674,Jazz in”B♭”,ジャズインビーフラット,,静岡県浜松市東区半田山5-16-17,4313125,221309,静岡県,,浜松市,東区,半田山5-16-17,,34.775968,137.741391,7671,喫茶店,,,,,(053)435-5644,,,http://b-flat.cafe.coocan.jp/,,,,,,,,,2021-03-04,,
F0673,和風バル志道,ワフウバルシドウ,,静岡県浜松市中区木戸町13-1エムケー木戸1階,4300806,221309,静岡県,,浜松市,中区,木戸町13-1,エムケー木戸1階,34.707217,137.744359,7621,日本料理店,,,,,(053)571-0961,,,,,,,,,,,,2021-02-26,,
F0669,ポエータ入野店,ポエータイリノテン,,静岡県浜松市西区入野町16334-1,4328061,221309,静岡県,,浜松市,西区,入野町16334-1,,34.701196,137.675309,7611,食堂，レストラン（専門料理店を除く）,,,,,(053)440-5828,,,https://poeta.jp/,,,,,,,,,2021-02-26,,
F0661,雅楽之助天王店,ウタノスケテンノウテン,,静岡県浜松市東区天王町349-1,4350052,221309,静岡県,,浜松市,東区,天王町349-1,,34.736453,137.780117,7631,そば・うどん店,,,,,(053)422-6166,,,,,,,,,,,,2021-02-26,,
F0649,黒フネ,クロフネ,,静岡県浜松市中区田町325-38,4300944,221309,静岡県,,浜松市,中区,田町325-38,,34.707639,137.729940,7651,酒場，ビヤホール,,,,,(053)456-7377,,,,,,,,,,,,2021-02-26,,
F0648,うなぎ料理　あつみ,ウナギリョウリアツミ,,静岡県浜松市中区千歳町70,4300934,221309,静岡県,,浜松市,中区,千歳町70,,34.704464,137.730623,7629,その他の専門料理店,,,,,(053)455-1460,,,http://unagi-atsumi.com/,,,,,,,,,2021-02-26,,
F0634,焼肉ハウス扇寿,ヤキニクハウスセンジュ,,静岡県浜松市中区中沢町80-25,4300904,221309,静岡県,,浜松市,中区,中沢町80-25,,34.723161,137.731201,7625,焼き肉店,,,,,(053)471-6060,,,https://sen-jyu.com/,,,,,,,,,2021-02-26,,
F0577,牛角浜松有玉店,ギュウカクハママツアリタマテン,,静岡県浜松市東区有玉北町760-1,4313121,221309,静岡県,,浜松市,東区,有玉北町760-1,,34.766571,137.756664,7625,焼き肉店,,,,,(053)545-3629,,,https://www.gyukaku.ne.jp/,,,,,,,,,2021-03-01,,
F0576,牛角和合店,ギュウカクワゴウテン,,静岡県浜松市中区和合町193-8,4338125,221309,静岡県,,浜松市,中区,和合町193-8,,34.732693,137.722258,7625,焼き肉店,,,,,(053)412-2929,,,https://www.gyukaku.ne.jp/,,,,,,,,,2021-03-01,,
F0575,牛角入野店,ギュウカクイリノテン,,静岡県浜松市西区入野町6393,4328061,221309,静岡県,,浜松市,西区,入野町6393,,34.698344,137.687665,7625,焼き肉店,,,,,(053)445-2929,,,https://www.gyukaku.ne.jp/,,,,,,,,,2021-03-01,,
F0531,宇奈貴うふみ亭,ウナタカウフミテイ,,静岡県浜松市西区雄踏町宇布見9515,4310102,221309,静岡県,,浜松市,西区,雄踏町宇布見9515,,34.704932,137.629180,7629,その他の専門料理店,,,,,(053)596-0630,,,,,,,,,,,,2020-10-30,,
F0842,トロンバ市野本店,トロンバイチノホンテン,,静岡県浜松市東区小池町2627,4300056,221309,静岡県,,浜松市,東区,小池町2627,,34.741308,137.759007,7611,食堂，レストラン（専門料理店を除く）,,,,,(053)411-7755,,,http://www.tromba.jp/tromba_ichino/,,,,,,,,,2021-03-08,,
F0841,ぼんぼんげ,ボンボンゲ,,静岡県浜松市浜北区貴布祢オクトワール浜北1F,4340038,221309,静岡県,,浜松市,浜北区,貴布祢,オクトワール浜北1F,34.797417,137.785955,7611,食堂，レストラン（専門料理店を除く）,,,,,(053)585-0089,,,,,,,,,,,,2021-03-08,,
F0835,千年たまごや,センネンタマゴヤ,,静岡県浜松市西区雄踏1-16-18,4310103,221309,静岡県,,浜松市,西区,雄踏1-16-18,,34.694378,137.644421,7611,食堂，レストラン（専門料理店を除く）,,,,,(053)488-6355,,,https://japanese-izakaya-restaurant-15548.business.site/,,,,,,,,,2021-03-08,,
F0833,割烹　八千代,カッポウヤチヨ,,静岡県浜松市中区肴町318-18,4300932,221309,静岡県,,浜松市,中区,肴町318-18,,34.706299,137.729780,7621,日本料理店,,,,,(053)452-3356,,,,,,,,,,,,2021-03-08,,
F0831,やきとり大樹,ヤキトリダイジュ,,静岡県浜松市中区田町331-9マルケンビル1階,4300944,221309,静岡県,,浜松市,中区,田町331-9,マルケンビル1階,34.706411,137.732072,7651,酒場，ビヤホール,,,,,(053)452-3501,,,,,,,,,,,,2021-03-08,,
F0829,椰子家,ヤシヤ,,静岡県浜松市中区元浜町321-1,4300942,221309,静岡県,,浜松市,中区,元浜町321-1,,34.717331,137.731649,7611,食堂，レストラン（専門料理店を除く）,,,,,(053)471-7122,,,,,,,,,,,,2021-03-08,,
F0828,本家　酒夢来,ホンケサムライ,,静岡県浜松市中区肴町318-31F,4300932,221309,静岡県,,浜松市,中区,肴町318-3,1F,34.706403,137.729327,7611,食堂，レストラン（専門料理店を除く）,,,,,(053)458-0344,,,,,,,,,,,,2021-03-08,,
F0826,リンデン,リンデン,,静岡県浜松市中区高丘北2-27-24,4338119,221309,静岡県,,浜松市,中区,高丘北2-27-24,,34.762705,137.704844,7629,その他の専門料理店,,,,,(053)439-3111,,,,,,,,,,,,2021-03-08,,
F0822,福和来,フクワライ,,静岡県浜松市中区千歳町3939ビル2階,4300934,221309,静岡県,,浜松市,中区,千歳町39,39ビル2階,34.704727,137.729927,7651,酒場，ビヤホール,,,,,(053)458-1311,,,,,,,,,,,,2021-03-08,,
F0821,のみくい亭びんご,ノミクイテイビンゴ,,静岡県浜松市東区北島町655,4350041,221309,静岡県,,浜松市,東区,北島町655,,34.729141,137.781707,7651,酒場，ビヤホール,,,,,(053)421-8677,,,,,,,,,,,,2021-03-08,,
F0819,桃園,トウエン,,静岡県浜松市中区和合町220-1390,4338125,221309,静岡県,,浜松市,中区,和合町220-1390,,34.739917,137.704409,7623,中華料理店,,,,,(053)471-4032,,,https://toenwago.com,,,,,,,,,2021-03-08,,
F0815,焼肉きんぐ　志都呂店,ヤキニクキングシトロテン,,静岡県浜松市西区志都呂町1-39-34,4328066,221309,静岡県,,浜松市,西区,志都呂町1-39-34,,34.698032,137.658332,7625,焼き肉店,,,,,(053)448-1129,,,,,,,,,,,,2021-03-08,,
F0812,Beige,ベージュ,,静岡県浜松市中区連尺町313-5ゴールドサークル連尺1F,4300939,221309,静岡県,,浜松市,中区,連尺町313-5,ゴールドサークル連尺1F,34.706710,137.728441,7611,食堂，レストラン（専門料理店を除く）,,,,,(053)457-0188,,,,,,,,,,,,2021-03-08,,
F0810,浜名湖リゾート＆スパ　THE　OCEAN,ハマナコリゾートアンドスパジオーシャン,,静岡県浜松市西区舞阪町弁天島3285-88,4310214,221309,静岡県,,浜松市,西区,舞阪町弁天島3285-88,,34.689969,137.602022,7611,食堂，レストラン（専門料理店を除く）,,,,,(053)592-1155,,,http://kts-the-ocean.com/,,,,,,,,,2021-03-08,,
F0808,肉処　小林邸,ニクドコロショウリンジ,,静岡県浜松市北区初生町336-1,4338112,221309,静岡県,,浜松市,北区,初生町336-1,,34.760600,137.725109,7625,焼き肉店,,,,,(053)488-8330,,,,,,,,,,,,2021-03-08,,
F0806,中国料理ローラン,チュウゴクリョウリローラン,,静岡県浜松市浜北区小松3110-1,4340042,221309,静岡県,,浜松市,浜北区,小松3110-1,,34.783610,137.768110,7623,中華料理店,,,,,(053)586-1448,,,https://www.lorlan.com/home.htm,,,,,,,,,2021-03-08,,
F0800,鮨みよし,スシミヨシ,,静岡県浜松市北区三ヶ日町三ヶ日688-5,4311414,221309,静岡県,,浜松市,北区,三ヶ日町三ヶ日688-5,,34.804358,137.552446,7641,すし店,,,,,(053)524-0226,,,,,,,,,,,,2021-03-08,,
F0794,お菓子の森＆蔵のカフェ,オカシノモリアンドクラノカフェ,,静岡県浜松市東区和田町484,4350016,221309,静岡県,,浜松市,東区,和田町484,,34.718848,137.771862,7671,喫茶店,,,,,(053)571-5587,,,https://okashinomori.net/kura/,,,,,,,,,2021-03-08,,
F0791,お庭のはなれ,オニワノハナレ,,静岡県浜松市中区葵東2-11-20ハイツ白井1階中,4338114,221309,静岡県,,浜松市,中区,葵東2-11-20,ハイツ白井1階中,34.761417,137.722738,7651,酒場，ビヤホール,,,,,(053)439-3989,,,https://s.tabelog.com/shizuoka/A2202/A220201/22032792/,,,,,,,,,2021-03-08,,
F0790,とっちゃば,トッチャバ,,静岡県浜松市中区肴町316-38尾越イキシアビル1階,4300932,221309,静岡県,,浜松市,中区,肴町316-38,尾越イキシアビル1階,34.707158,137.729652,7651,酒場，ビヤホール,,,,,(053)488-9010,,,https://s.tabelog.com/shizuoka/A2202/A220201/22028459/,,,,,,,,,2021-03-08,,
F0789,omiso,オミソ,,静岡県浜松市中区肴町316-38尾越イキシアビル地下1階南,4300932,221309,静岡県,,浜松市,中区,肴町316-38,尾越イキシアビル地下1階南,34.707158,137.729652,7651,酒場，ビヤホール,,,,,(053)458-5090,,,https://www.hotpepper.jp/strJ001036750/,,,,,,,,,2021-03-08,,
F0787,御食事処たかみ,オショクジドコロタカミ,,静岡県浜松市西区西山町107-6,4328001,221309,静岡県,,浜松市,西区,西山町107-6,,34.740988,137.691462,7611,食堂，レストラン（専門料理店を除く）,,,,,(053)485-0368,,,,,,,,,,,,2021-03-08,,
F0776,天竜そば松風庵,テンリュウソバショウフウアン,,静岡県浜松市北区三方原町503,4338105,221309,静岡県,,浜松市,北区,三方原町503,,34.775918,137.712967,7631,そば・うどん店,,,,,(053)414-3000,,,http://www.tenryusoba.com,,,,,,,,,2021-03-08,,
F0773,肉のラク,ニクノラク,,静岡県浜松市中区肴町316-39アクタスビル1F316-39,4300932,221309,静岡県,,浜松市,中区,肴町316-39,アクタスビル1F316-39,34.707140,137.729560,7625,焼き肉店,,,,,(053)451-5515,,,,,,,,,,,,2021-03-05,,
F0760,いずみ庵　三方原店,イズミアンミカタバラテン,,静岡県浜松市中区葵西1-2-8,4338111,221309,静岡県,,浜松市,中区,葵西1-2-8,,34.764386,137.715478,7631,そば・うどん店,,,,,(053)437-6438,,,,,,,,,,,,2021-03-08,,
F0759,スナック鳳来,スナックホウライ,,静岡県浜松市中区助信町31-46,4300903,221309,静岡県,,浜松市,中区,助信町31-46,,34.723866,137.735337,7661,バー，キャバレー，ナイトクラブ,,,,,(090)4852-4564,,,,,,,,,,,,2021-03-05,,
F0728,La Lanterna,ラランテルナ,,静岡県浜松市中区下池川町33-9,4300905,221309,静岡県,,浜松市,中区,下池川町33-9,,34.718102,137.728467,7629,その他の専門料理店,,,,,(053)471-7155,,,,,,,,,,,,2021-03-08,,
F0708,伊勢路,イセジ,,静岡県浜松市中区佐鳴台4-37-38,4328021,221309,静岡県,,浜松市,中区,佐鳴台4-37-38,,34.712039,137.700332,7611,食堂，レストラン（専門料理店を除く）,,,,,(053)440-0311,,,https://www.unagiya.co.jp/iseji.html,,,,,,,,,2021-03-05,,
F0676,リストランテイルマルカンポ,リストランテイルマルカンポ,,静岡県浜松市中区助信町10-8,4300903,221309,静岡県,,浜松市,中区,助信町10-8,,34.720809,137.737907,7611,食堂，レストラン（専門料理店を除く）,,,,,(053)443-7915,,,,,,,,,,,,2021-03-05,,
F0861,プロプル,プロプル,,静岡県浜松市中区鍛冶町320-3アンセットビル2F,4300933,221309,静岡県,,浜松市,中区,鍛冶町320-3,アンセットビル2F,34.706247,137.730454,7629,その他の専門料理店,,,,,(053)523-6161,,,,,,,,,,,,2021-03-10,,
F0859,柚露,ユウロ,,静岡県浜松市中区板屋町101-2えのもとビル1階,4300928,221309,静岡県,,浜松市,中区,板屋町101-2,えのもとビル1階,34.707990,137.733312,7621,日本料理店,,,,,(053)456-1003,,,evergreen-yuro.com,,,,,,,,,2021-03-10,,
F0855,ピッツァなお,ピッツァナオ,,静岡県浜松市中区和地山1-7-18チサンマンション和地山1階,4328003,221309,静岡県,,浜松市,中区,和地山1-7-18,チサンマンション和地山1階,34.727092,137.720174,7629,その他の専門料理店,,,,,(053)523-6335,,,https://pizza-nao.jp,,,,,,,,,2021-03-10,,
F0854,Blue Bee,ブルービー,,静岡県浜松市中区板屋町2-107,4300928,221309,静岡県,,浜松市,中区,板屋町2-107,,34.706802,137.733846,7661,バー，キャバレー，ナイトクラブ,,,,,(053)523-7888,,,,,,,,,,,,2021-03-10,,
F0852,はまなす,ハマナス,,静岡県浜松市中区千歳町136牧田ビル1F,4300934,221309,静岡県,,浜松市,中区,千歳町136,牧田ビル1F,34.703101,137.730910,7651,酒場，ビヤホール,,,,,(053)454-8968,,,https://www.hotpepper.jp/strJ000724278/,,,,,,,,,2021-03-10,,
F0850,ラーメン入来,ラーメンイリキ,,静岡県浜松市東区市野町655,4350051,221309,静岡県,,浜松市,東区,市野町655,,34.750894,137.771032,7624,ラーメン店,,,,,(053)434-3681,,,,,,,,,,,,2021-03-10,,
F0846,ハイボール酒場貴布祢,ハイボールサカバキブネ,,静岡県浜松市浜北区貴布祢115-1センタービル貴布祢3F,4340038,221309,静岡県,,浜松市,浜北区,貴布祢115-1,センタービル貴布祢3F,34.791718,137.781941,7651,酒場，ビヤホール,,,,,(053)585-8080,,,,,,,,,,,,2021-03-10,,
F0845,ライブラウンジさくら,ライブラウンジサクラ,,静岡県浜松市浜北区貴布祢115-1センタービル貴布祢4F,4340038,221309,静岡県,,浜松市,浜北区,貴布祢115-1,センタービル貴布祢4F,34.791718,137.781941,7611,食堂，レストラン（専門料理店を除く）,,,,,(053)586-2666,,,,,,,,,,,,2021-03-10,,
F0844,浜名湖うなぎ　だいだら,ハマナコウナギダイダラ,,静岡県浜松市中区鴨江3-68-8アサヒ開発ビル1-A,4328023,221309,静岡県,,浜松市,中区,鴨江3-68-8,アサヒ開発ビル1-A,34.705818,137.707099,7629,その他の専門料理店,,,,,(053)525-8511,,,,,,,,,,,,2021-03-10,,
F0840,炭火焼八剣伝浜北駅前店,スミビヤキハッケンデンハマキタエキマエテン,,静岡県浜松市浜北区貴布祢115-1センタービル貴布祢101,4340038,221309,静岡県,,浜松市,浜北区,貴布祢115-1,センタービル貴布祢101,34.791718,137.781941,7651,酒場，ビヤホール,,,,,(053)585-0860,,,,,,,,,,,,2021-03-10,,
F0839,炭火焼八剣伝浜北店,スミビヤキハッケンデンハマキタテン,,静岡県浜松市浜北区本沢合1069-1,4340014,221309,静岡県,,浜松市,浜北区,本沢合1069-1,,34.813714,137.795226,7651,酒場，ビヤホール,,,,,(053)584-1313,,,,,,,,,,,,2021-03-10,,
F0838,カレー処ヤサカ,カレードコロヤサカ,,静岡県浜松市中区領家1-7-30,4300852,221309,静岡県,,浜松市,中区,領家1-7-30,,34.699257,137.752460,7629,その他の専門料理店,,,,,(053)463-0223,,,https://www.yasaca.jp/,,,,,,,,,2021-03-10,,
F0837,地鶏酒房赤どり,ヂドリシュボウアカドリ,,静岡県浜松市南区飯田町959,4350028,221309,静岡県,,浜松市,南区,飯田町959,,34.706538,137.772120,7651,酒場，ビヤホール,,,,,(053)469-0100,,,,,,,,,,,,2021-03-10,,
F0832,Garden Cafe HACKBERRY,ガーデンカフェハックベリー,,静岡県浜松市北区都田町8497-2,4312102,221309,静岡県,,浜松市,北区,都田町8497-2,,34.814992,137.733144,7671,喫茶店,,,,,(053)428-7003,,,,,,,,,,,,2021-03-10,,
F0830,すえひろ,スエヒロ,,静岡県浜松市浜北区於呂3035-1,4340015,221309,静岡県,,浜松市,浜北区,於呂3035-1,,34.824780,137.798944,7651,酒場，ビヤホール,,,,,(053)588-5070,,,,,,,,,,,,2021-03-10,,
F0827,旬鮮庵ひなた,シュンセンアンヒナタ,,静岡県浜松市西区雄踏1-12-21エクシード[ 1-B,4310103,221309,静岡県,,浜松市,西区,雄踏1-12-21,エクシード[ 1-B,34.695957,137.645556,7651,酒場，ビヤホール,,,,,(053)592-0400,,,https://hinata.be,,,,,,,,,2021-03-10,,
F0824,一杯一笑　梵　浜北店,イッパイイッショウボンハマキタテン,,静岡県浜松市浜北区西美薗28-6,4340033,221309,静岡県,,浜松市,浜北区,西美薗28-6,,34.793022,137.789459,7651,酒場，ビヤホール,,,,,(053)589-3387,,,,,,,,,,,,2021-03-10,,
F0823,THE SMOKE CLUB,ザスモーククラブ,,静岡県浜松市中区千歳町135-5,4300934,221309,静岡県,,浜松市,中区,千歳町135-5,,34.703042,137.730897,7629,その他の専門料理店,,,,,(053)548-4792,,,https://www.hotpepper.jp/strJ001203807/amp/,,,,,,,,,2021-03-10,,
F0817,餃子一代,ギョウザイチダイ,,静岡県浜松市中区板屋町1-3ホテルアセントプラザ浜松,4300928,221309,静岡県,,浜松市,中区,板屋町1-3,ホテルアセントプラザ浜松,34.706696,137.733829,7623,中華料理店,,,,,(053)453-2882,,,https://www.lorlan.com/ichidai/,,,,,,,,,2021-03-10,,
F0816,炭焼　のっぽ,スミヤキノッポ,,静岡県浜松市西区入野町6229-1,4328061,221309,静岡県,,浜松市,西区,入野町6229-1,,34.700171,137.690739,7621,日本料理店,,,,,(053)447-3412,,,http://www.noppo.net,,,,,,,,,2021-03-10,,
F0814,マリーザ浜名湖,マリーザハマナコ,,静岡県浜松市北区細江町中川5386,4311304,221309,静岡県,,浜松市,北区,細江町中川5386,,34.803873,137.660301,7611,食堂，レストラン（専門料理店を除く）,,,,,(053)523-2123,,,,,,,,,,,,2021-03-10,,
F0807,kiki CAFE&BAR,キキカフェアンドバー,,静岡県浜松市中区早馬町3-1天池館1F,4300916,221309,静岡県,,浜松市,中区,早馬町3-1,天池館1F,34.709737,137.733668,7611,食堂，レストラン（専門料理店を除く）,,,,,(053)548-6148,,,www.kiki-cafe.com/,,,,,,,,,2021-03-10,,
F0803,むつみ屋　有玉店,ムツミヤアリタマテン,,静岡県浜松市東区有玉南町549-4,4313122,221309,静岡県,,浜松市,東区,有玉南町549-4,,34.756646,137.752060,7611,食堂，レストラン（専門料理店を除く）,,,,,(053)435-7623,,,https://mutsumi-ya.net/,,,,,,,,,2021-03-10,,
F0797,しまうま珈琲幸店,シマウマコーヒーサイワイテン,,静岡県浜松市中区幸1-4-12,4338123,221309,静岡県,,浜松市,中区,幸1-4-12,,34.739256,137.723861,7611,食堂，レストラン（専門料理店を除く）,,,,,(053)471-4696,,,http://shimaumacoffee.com/,,,,,,,,,2021-03-10,,
F0795,あまた屋,アマタヤ,,静岡県浜松市南区富屋町182,4300824,221309,静岡県,,浜松市,南区,富屋町182,,34.678072,137.777249,7611,食堂，レストラン（専門料理店を除く）,,,,,(053)426-6507,,,,,,,,,,,,2021-03-10,,
F0763,炭焼鰻はじめ,スミヤキウナギハジメ,,静岡県浜松市西区雄踏町宇布見9690,4310102,221309,静岡県,,浜松市,西区,雄踏町宇布見9690,,34.700518,137.633215,7629,その他の専門料理店,,,,,(053)570-8075,,,,,,,,,,,,2021-03-10,,
F0761,いずみ庵　富塚店,イズミアントミツカテン,,静岡県浜松市中区富塚町590-14,4328002,221309,静岡県,,浜松市,中区,富塚町590-14,,34.723806,137.705195,7631,そば・うどん店,,,,,(053)471-9400,,,,,,,,,,,,2021-03-10,,
F0707,韓丼浜松住吉店,カンドンハママツスミヨシテン,,静岡県浜松市中区住吉　2-8-20,4300906,221309,静岡県,,浜松市,中区,住吉　2-8-20,,34.730346,137.727376,7629,その他の専門料理店,,,,,(053)543-7600,,,http://kandon.jp/,,,,,,,,,2021-03-09,,
F0888,カフェやまと浜松店,カフェヤマトハママツテン,,静岡県浜松市中区砂山町324-15エンホテル浜松1階,4300926,221309,静岡県,,浜松市,中区,砂山町324-15,エンホテル浜松1階,34.702371,137.733849,7611,食堂，レストラン（専門料理店を除く）,,,,,(080)6518-4377,,,,,,,,,,,,2021-03-12,,
